SL_No,Ref#,Standard#,Head_Level,H1#,H1_Ch_Title,H1_Credits,H2#,H2_Sec_Title,H2_Credits,H3#,H3_Sec_Title,H3_Credits,Item#,Standard_Text,Prerequisite,Goals,Phases,Points,Instruction Subpart,Instruction,FigA_No,FigA_Caption,FigA_AltTag,FigA_Status,FigB_No,FigB_Caption,FigB_AltTag,FigB_Status,FigC_No,FigC_Caption,FigC_AltTag,FigC_Status,FigD_No,FigD_Caption,FigD_AltTag,FigD_Status
319,749,6.8.1.5,H2,6,Rooms and Spaces,30,8,Public Assembly Spaces,2,1,Configuration,1,5,All public assembly spaces have adjustable spectator seating areas that accommodate various configurations.,,Body FitPersonalization,Design DevelopmentSchematic Design,1,1,1 Credit: Implement 3 of 5,,,,,,,,,,,,,,,,
320,240,6.8.2.1,H3,6,Rooms and Spaces,30,8,Public Assembly Spaces,2,2,Aisles,1,1,All aisles serving  accessible seating areas are not separated from those serving general seating areas.,,AwarenessSocial Integration,Design DevelopmentSchematic Design,1,2,1 Credit: Implement 2 of 4,,,,,,,,,,,,,,,,
321,242,6.8.2.2,H3,6,Rooms and Spaces,30,8,Public Assembly Spaces,2,2,Aisles,1,2,All aisle edges are marked with a distinct color and/or texture.,,Awareness,SpecificationsDesign Development,1,2,1 Credit: Implement 2 of 4,Fig_242.png,Aisle edge contrast,Plan drawing of a room with tiered seating. The aisle and stair treads are marked with yellow striping.,Latest Version,,,,,,,,,,,,
322,243,6.8.2.3,H3,6,Rooms and Spaces,30,8,Public Assembly Spaces,2,2,Aisles,1,3,"When located in areas where lights are sometimes dimmed for performances, all aisles are illuminated using a diffuser or reflective device such that bulbs are not directly visible by people in the space.",,ComfortAwareness,Design DevelopmentSpecifications,1,2,1 Credit: Implement 2 of 4,Fig_243A.png,Stairs in assembly room illuminated by low-level indirect lighting,Photograph of dark assembly room with stairs lit by downward lighting affixed to handrails.,Latest Version,Fig_243B.png,Stairs in assembly room illuminated by direct diffused lighting,"Photograph of dark assembly room with stairs lit by light fixture integrated with stair riser, with diffusing device.",Latest Version,,,,,,,,
323,244,6.8.2.4,H3,6,Rooms and Spaces,30,8,Public Assembly Spaces,2,2,Aisles,1,4,All aisles on primary routes have tactile guide strips leading users to the nearest appropriate entrances and exits.,,Awareness,Design Development,1,2,1 Credit: Implement 2 of 4,,,,,,,,,,,,,,,,
324,675,6.9.1,H2,6,Rooms and Spaces,30,9,Food Service Areas,2,0,,0,1,"All food service areas have all appliances, counters, tray slides, buffets, condiments, tableware, and accompaniment stations within reach and adjacent to a clear floor space.",Required,Body Fit,Design DevelopmentSpecificationsOperations,1,9,2 Credits: Implement 3 of 7      |      1 Credit: Implement 2 of 7,Fig_675.png,"Reach range for appliances, counters, tray slides, buffets, condiments, tableware, and accompaniment stations","Section drawing depicts a person using a wheelchair reaching for items on a buffet table containing bowls, plates, serving trays, coffee mugs, a drink dispenser, and condiments. A dotted line indicate",Latest Version,,,,,,,,,,,,
325,257,6.9.2,H2,6,Rooms and Spaces,30,9,Food Service Areas,2,0,,0,2,All food service areas have tables arranged so people who use wheeled mobility devices can access them without obstructing the circulation space or disrupting others.,Required,Body FitSocial Integration,Design DevelopmentSpecificationsOperations,1,9,2 Credits: Implement 3 of 7      |      1 Credit: Implement 2 of 7,,,,,,,,,,,,,,,,
326,707,6.9.3,H2,6,Rooms and Spaces,30,9,Food Service Areas,2,0,,0,3,Selected outdoor dining areas are adjacent to indoor dining areas.,,Comfort,Schematic DesignDesign Development,1,9,2 Credits: Implement 3 of 7      |      1 Credit: Implement 2 of 7,Fig_707.png,Outdoor dining areas adjacent to indoor dining areas,"Plan view drawing of an indoor dining area with an adjacent outdoor dining area, connected by a doorway.",Latest Version,,,,,,,,,,,,
327,708,6.9.4,H2,6,Rooms and Spaces,30,9,Food Service Areas,2,0,,0,4,"Selected outdoor dining areas are on a hard surface (e.g., concrete, wood decking, etc.).",,Comfort,Design Development,1,9,2 Credits: Implement 3 of 7      |      1 Credit: Implement 2 of 7,Fig_708.png,Outdoor dining area,"Photograph of a brick paver patio, with bricks close together. On the patio is a woman sitting at a picnic table.",Latest Version,,,,,,,,,,,,
328,507,6.9.5,H2,6,Rooms and Spaces,30,9,Food Service Areas,2,0,,0,5,"Selected outdoor dining areas have an active heating or cooling mechanism (e.g., radiant heat/cooling, heat lamps, fans, etc.).",,ComfortWellnessCultural Appropriateness,Design DevelopmentSpecifications,1,9,2 Credits: Implement 3 of 7      |      1 Credit: Implement 2 of 7,,,,,,,,,,,,,,,,
329,271,6.9.6,H2,6,Rooms and Spaces,30,9,Food Service Areas,2,0,,0,6,All drive-through food service lines accommodate full-size vans.,,Body Fit,Design Development,1,9,2 Credits: Implement 3 of 7      |      1 Credit: Implement 2 of 7,Fig_271.png,Minimum clearance height for full-size van,"Drawing of a van next to a building with a drive through window. The building roof partially extends over the van with a minimum dimension of 98 inches indicated (or 2,590 millimeters).",Latest Version,,,,,,,,,,,,
330,269,6.9.7,H2,6,Rooms and Spaces,30,9,Food Service Areas,2,0,,0,7,"Food service lines for take-out are separated from other food service lines, waiting, and/or dining areas.",,Comfort,Design DevelopmentOperations,1,9,2 Credits: Implement 3 of 7      |      1 Credit: Implement 2 of 7,,,,,,,,,,,,,,,,
331,272,6.10.1.1,H3,6,Rooms and Spaces,30,10,Retail Spaces,3,1,Aisles,1,1,All aisles are the width of two clear floor spaces.,,Body Fit,Design DevelopmentSchematic Design,1,1,1 Credit: Implement 3 of 5,,,,,,,,,,,,,,,,
332,273,6.10.1.2,H3,6,Rooms and Spaces,30,10,Retail Spaces,3,1,Aisles,1,2,All aisles have an intersecting aisle at both ends.,,Comfort,Design DevelopmentSchematic Design,1,1,1 Credit: Implement 3 of 5,Fig_273.png,"On the left, dead-end aisles create congestion. On the right,  intersecting aisles eliminate congestion.",Plan view drawings of two grocery stores. One has dead end aisles. The other has an intersecting aisle at both ends.,Latest Version,,,,,,,,,,,,
333,274,6.10.1.3,H3,6,Rooms and Spaces,30,10,Retail Spaces,3,1,Aisles,1,3,Displays or other obstructions do not reduce the effective width of any aisle.,,Body Fit,Design DevelopmentOperations,1,1,1 Credit: Implement 3 of 5,Fig_274.png,"On the left, display cases crowd the aisles. On the right, displays are in line shelving units, eliminating congestion.",Plan view drawings of two grocery stores. One has display cases encroaching on the aisles. The other keeps special displays in line with the shelving units.,Latest Version,,,,,,,,,,,,
334,279,6.10.1.4,H3,6,Rooms and Spaces,30,10,Retail Spaces,3,1,Aisles,1,4,"All aisles have signs perpendicular to the cross-aisles that list aisle contents in multiple formats (e.g., text, pictogram, Braille, audio, etc.).",,Awareness,SpecificationsOperations,1,1,1 Credit: Implement 3 of 5,,,,,,,,,,,,,,,,
335,771,6.10.1.5,H3,6,Rooms and Spaces,30,10,Retail Spaces,3,1,Aisles,1,5,All aisles near toilet rooms and transaction machines have extra space for users to temporarily store shopping carts outside of the circulation space.,,Body Fit,Design Development,1,1,1 Credit: Implement 3 of 5,Fig_771.png,Shopping cart storage area outside toilet room,"Plan drawing of a shopping cart indicating dimensions of 24 by 42 inches (610 by 1,065 millimeters).",Latest Version,,,,,,,,,,,,
336,280,6.10.2.1,H2,6,Rooms and Spaces,30,10,Retail Spaces,3,2,Product Displays,1,1,All product displays have an adjacent clear floor space.,,Body Fit,Design Development,1,2,1 Credit: Implement 2 of 4,,,,,,,,,,,,,,,,
337,283,6.10.2.2,H2,6,Rooms and Spaces,30,10,Retail Spaces,3,2,Product Displays,1,2,"Where customer interaction with a product or self-retrieval of products is intended, all such product displays are within reach or have a means of summoning staff assistance.",,ComfortBody FitWellness,Design DevelopmentOperationsSpecifications,1,2,1 Credit: Implement 2 of 4,,,,,,,,,,,,,,,,
338,284,6.10.2.3,H2,6,Rooms and Spaces,30,10,Retail Spaces,3,2,Product Displays,1,3,"Where customer interaction with a product or self-retrieval of products is intended, all such product displays have a moveable step available for reaching high items.",,Body FitPersonalization,Design DevelopmentSpecifications,1,2,1 Credit: Implement 2 of 4,,,,,,,,,,,,,,,,
339,281,6.10.2.4,H2,6,Rooms and Spaces,30,10,Retail Spaces,3,2,Product Displays,1,4,All product displays expose customers to all goods without requiring them to move items out of the way.,,Comfort,Operations,1,2,1 Credit: Implement 2 of 4,,,,,,,,,,,,,,,,
340,287,6.10.3.1,H2,6,Rooms and Spaces,30,10,Retail Spaces,3,3,Pricing and Product Information,1,1,Pricing and product information is displayed for all merchandise.,,Awareness,Operations,1,3,1 Credit: Implement 2 of 3,,,,,,,,,,,,,,,,
341,290,6.10.3.2,H2,6,Rooms and Spaces,30,10,Retail Spaces,3,3,Pricing and Product Information,1,2,All pricing and product information is readable with a smartphone or store-provided scanner.,,Awareness,Operations,1,3,1 Credit: Implement 2 of 3,,,,,,,,,,,,,,,,
342,291,6.10.3.3,H2,6,Rooms and Spaces,30,10,Retail Spaces,3,3,Pricing and Product Information,1,3,"Where pricing is dependent on product weight, the customer can ascertain weight and cost prior to checkout using a scale.",,Awareness,Operations,1,3,1 Credit: Implement 2 of 3,,,,,,,,,,,,,,,,
343,249,6.11.1,H2,6,Rooms and Spaces,30,11,Sleeping Rooms,3,0,,0,1,Sleeping rooms that are designated as accessible are available at every price point and are horizontally and vertically dispersed.,,Social Integration,Design DevelopmentOperationsSchematic Design,1,11,3 Credits: Implement 9 of 16      |      2 Credits: Implement 8 of 16      |      1 Credit: Implement 7 of 16,,,,,,,,,,,,,,,,
344,245,6.11.2,H2,6,Rooms and Spaces,30,11,Sleeping Rooms,3,0,,0,2,"All sleeping rooms are located where there is no more than one intersecting route between the room and nearest accessible elevator (or lobby, if on entrance level).",,AwarenessUnderstanding,Design DevelopmentSchematic Design,1,11,3 Credits: Implement 9 of 16      |      2 Credits: Implement 8 of 16      |      1 Credit: Implement 7 of 16,Fig_245.png,Floor plan of corridors serving sleeping rooms,Drawing of a building floor plan shaped like the letter H. The elevator lobby is in the center of the H. The corridors follow the H shape with arrows extending from the elevators to two rooms at oppos,Latest Version,,,,,,,,,,,,
345,246,6.11.3,H2,6,Rooms and Spaces,30,11,Sleeping Rooms,3,0,,0,3,"Sleeping rooms are arranged in zones that are visually differentiated by color, architectural features, or landmarks.",,AwarenessUnderstanding,Design Development,1,11,3 Credits: Implement 9 of 16      |      2 Credits: Implement 8 of 16      |      1 Credit: Implement 7 of 16,,,,,,,,,,,,,,,,
346,250,6.11.4,H2,6,Rooms and Spaces,30,11,Sleeping Rooms,3,0,,0,4,"Some but not all sleeping rooms that are designated as accessible are available near elevators and/or amenities (such as pools, lounges, or vending areas).",,Comfort,Design DevelopmentSchematic Design,1,11,3 Credits: Implement 9 of 16      |      2 Credits: Implement 8 of 16      |      1 Credit: Implement 7 of 16,Fig_250.png,"Plan diagram of a hotel floor with elevators in the center. Of the 17 rooms on the floor, 4 are marked with the active symbol of accessibility. Two are near the elevator lobby and two are far from the",,Latest Version,,,,,,,,,,,,
347,251,6.11.5,H2,6,Rooms and Spaces,30,11,Sleeping Rooms,3,0,,0,5,Sleeping rooms that are designated as accessible have a wheelchair/scooter parking area outside of circulation space with an adjacent electrical outlet.,,Body FitComfort,Design Development,1,11,3 Credits: Implement 9 of 16      |      2 Credits: Implement 8 of 16      |      1 Credit: Implement 7 of 16,Fig_251.png,This wheelchair/scooter recharging station does not obstruct other furniture or the circulation route.,"Drawing of a sleeping room with a king size bed, bathroom, closet, desk, chair, and power scooter. The power scooter is plugged into the wall and out of the way of the circulation route and the other ",Latest Version,,,,,,,,,,,,
348,253,6.11.6,H2,6,Rooms and Spaces,30,11,Sleeping Rooms,3,0,,0,6,All sleeping rooms have a storage space large enough to store luggage outside of the circulation space.,,Body Fit,Design Development,1,11,3 Credits: Implement 9 of 16      |      2 Credits: Implement 8 of 16      |      1 Credit: Implement 7 of 16,Fig_253A.png,Space to store luggage,"Plan drawing of a hotel room with luggage highlighted, stored in between the closet and desk, outside of a wheelchair turning space. Another piece of luggage is stored at the end of the room, adjacent",Latest Version,Fig_253B.png,Sleeping room with luggage storage space in closet or on low furniture,"Drawing of a hotel room with a king size bed , two chairs, power scooter, and closet. It also has a low linear storage unit with drawers and a T V on top. A piece of luggage is stored in the extra spa",Latest Version,,,,,,,,
349,247,6.11.7,H2,6,Rooms and Spaces,30,11,Sleeping Rooms,3,0,,0,7,Sleeping rooms are available with a variety of different furniture layouts within each price point.,,PersonalizationComfortBody Fit,Design DevelopmentOperationsSpecifications,1,11,3 Credits: Implement 9 of 16      |      2 Credits: Implement 8 of 16      |      1 Credit: Implement 7 of 16,Fig_247.png,Examples of different room types and furniture layouts,"Drawings of 4 different sleeping room plans: All have a closet and bathroom and all are accessible. One has a king size bed in a suite with a kitchen, living area, and desk. Another has a king size be",Latest Version,,,,,,,,,,,,
350,248,6.11.8,H2,6,Rooms and Spaces,30,11,Sleeping Rooms,3,0,,0,8,All sleeping rooms have moveable furniture.,,Body FitPersonalizationComfort,SpecificationsOperations,1,11,3 Credits: Implement 9 of 16      |      2 Credits: Implement 8 of 16      |      1 Credit: Implement 7 of 16,,,,,,,,,,,,,,,,
351,750,6.11.9,H2,6,Rooms and Spaces,30,11,Sleeping Rooms,3,0,,0,9,All sleeping rooms have connectivity to electrical power at the bedside.,,ComfortBody Fit,Specifications,1,11,3 Credits: Implement 9 of 16      |      2 Credits: Implement 8 of 16      |      1 Credit: Implement 7 of 16,,,,,,,,,,,,,,,,
352,382,6.11.10,H2,6,Rooms and Spaces,30,11,Sleeping Rooms,3,0,,0,10,"All sleeping rooms allow remote control of room features such as entertainment system, lighting, thermostat, security system, etc.",,ComfortPersonalization,Specifications,1,11,3 Credits: Implement 9 of 16      |      2 Credits: Implement 8 of 16      |      1 Credit: Implement 7 of 16,,,,,,,,,,,,,,,,
353,379,6.11.11,H2,6,Rooms and Spaces,30,11,Sleeping Rooms,3,0,,0,11,All sleeping rooms have universal electrical plug adapters.,,Cultural Appropriateness,Operations,1,11,3 Credits: Implement 9 of 16      |      2 Credits: Implement 8 of 16      |      1 Credit: Implement 7 of 16,,,,,,,,,,,,,,,,
354,900,6.11.12,H2,6,Rooms and Spaces,30,11,Sleeping Rooms,3,0,,0,12,All sleeping rooms have user-controlled task lighting at the bedside and at any work station.,,PersonalizationComfort,Specifications,1,11,3 Credits: Implement 9 of 16      |      2 Credits: Implement 8 of 16      |      1 Credit: Implement 7 of 16,,,,,,,,,,,,,,,,
355,598,6.11.13,H3,6,Rooms and Spaces,30,11,Sleeping Rooms,3,0,,0,13,All sleeping rooms have lighting controls within reach of a person in bed.,,Body FitComfortWellness,Specifications,1,11,3 Credits: Implement 9 of 16      |      2 Credits: Implement 8 of 16      |      1 Credit: Implement 7 of 16,Fig_598.png,Acceptable height and distance from bed for lighting controls,"Drawing of a woman sitting up in bed, reaching toward a light switch and lamp on a night stand next to the bed. It depicts a lighting control height of 28 to 44 inches (710 to 1,120 millimeters) and a",Latest Version,,,,,,,,,,,,
356,254,6.11.14,H2,6,Rooms and Spaces,30,11,Sleeping Rooms,3,0,,0,14,All sleeping rooms have a securable safe along an accessible route with accessible operating mechanisms that provide audio and visual feedback during securement.,,Body FitAwarenessUnderstanding,OperationsSpecifications,1,11,3 Credits: Implement 9 of 16      |      2 Credits: Implement 8 of 16      |      1 Credit: Implement 7 of 16,,,,,,,,,,,,,,,,
357,431,6.11.15,H3,6,Rooms and Spaces,30,11,Sleeping Rooms,3,0,,0,15,All sleeping rooms (or bathing rooms within) provide a hair dryer.,,ComfortWellness,OperationsSpecifications,1,11,3 Credits: Implement 9 of 16      |      2 Credits: Implement 8 of 16      |      1 Credit: Implement 7 of 16,,,,,,,,,,,,,,,,
358,433,6.11.16,H3,6,Rooms and Spaces,30,11,Sleeping Rooms,3,0,,0,16,All sleeping rooms (or bathing rooms within) provide an adjustable mirror for detailed grooming tasks.,,ComfortWellness,OperationsSpecifications,1,11,3 Credits: Implement 9 of 16      |      2 Credits: Implement 8 of 16      |      1 Credit: Implement 7 of 16,Fig_433.png,Adjustable detail mirror,"Drawing of a circular mirror on a swinging arm, mounted to the wall.",Latest Version,,,,,,,,,,,,
359,252,6.12.1,H3,6,Rooms and Spaces,30,12,Storage Spaces,1,0,,0,1,"All storage spaces are adjustable to be within reach (including drawers, shelves, clothing rods, etc.).",,Body Fit,Design DevelopmentSpecifications,1,12,1 Credit: Implement 2 of 5,Fig_252.png,Various closet configurations,"Section drawings depicting 4 different closet arrangements, with varied clothing rod heights, drawer, and shelf positions.",Latest Version,Fig_252B.png,,,Under Development,,,,,,,,
360,256,6.12.2,H3,6,Rooms and Spaces,30,12,Storage Spaces,1,0,,0,2,All storage spaces are illuminated.,,Awareness,Design DevelopmentSpecifications,1,12,1 Credit: Implement 2 of 5,,,,,,,,,,,,,,,,
361,599,6.12.3,H3,6,Rooms and Spaces,30,12,Storage Spaces,1,0,,0,3,Selected storage spaces illuminate automatically when the door is opened.,,Comfort,Specifications,1,12,1 Credit: Implement 2 of 5,,,,,,,,,,,,,,,,
362,308,6.12.4,H3,6,Rooms and Spaces,30,12,Storage Spaces,1,0,,0,4,All storage spaces are securable.,,Personalization,Specifications,1,12,1 Credit: Implement 2 of 5,,,,,,,,,,,,,,,,
363,310,6.12.5,H3,6,Rooms and Spaces,30,12,Storage Spaces,1,0,,0,5,Selected storage spaces have wheels.,,Personalization,SpecificationsOperations,1,12,1 Credit: Implement 2 of 5,,,,,,,,,,,,,,,,
364,890,6.13.1,H2,6,Rooms and Spaces,30,13,Laundry Facilities,1,0,,0,1,At least 50% of washers and 50% of dryers are front loading and have controls within reach.,,Body Fit,Design DevelopmentSpecifications,1,13,1 Credit: Implement 2 of 3,,,,,,,,,,,,,,,,
365,849,6.13.2,H2,6,Rooms and Spaces,30,13,Laundry Facilities,1,0,,0,2,All shared laundry facilities have folding areas available at multiple heights or that are height-adjustable.,,Body FitPersonalization,Design DevelopmentSpecifications,1,13,1 Credit: Implement 2 of 3,,,,,,,,,,,,,,,,
366,891,6.13.3,H2,6,Rooms and Spaces,30,13,Laundry Facilities,1,0,,0,3,All shared laundry facilities have seating.,,Comfort,SpecificationsDesign Development,1,13,1 Credit: Implement 2 of 3,,,,,,,,,,,,,,,,
367,798,6.14.1,H2,6,Rooms and Spaces,30,14,Play Areas,1,0,,0,1,All play areas have continuous surfaces.,Required,Wellness,Design DevelopmentSpecifications,1,14,1 Credit: Implement 4 of 6,,,,,,,,,,,,,,,,
368,796,6.14.2,H2,6,Rooms and Spaces,30,14,Play Areas,1,0,,0,2,All play areas are enclosed.,,Wellness,Schematic DesignDesign Development,1,14,1 Credit: Implement 4 of 6,Fig_796.png,Enclosing the play area makes it safer for children to play since it allows parents or guardians to more easily look after them.,Plan drawing of an enclosed playground with seating inside and outside a shelter.,Latest Version,,,,,,,,,,,,
369,794,6.14.3,H2,6,Rooms and Spaces,30,14,Play Areas,1,0,,0,3,"All play areas have seating for parents and guardians, located within any enclosed area provided.",,ComfortWellness,Design DevelopmentSpecifications,1,14,1 Credit: Implement 4 of 6,Fig_794.png,Providing seating for parents and guardians makes their stay more comfortable and could lengthen the time they chose to stay.,Plan drawing of an enclosed playground with seating inside and outside a shelter.,Latest Version,,,,,,,,,,,,
370,795,6.14.4,H2,6,Rooms and Spaces,30,14,Play Areas,1,0,,0,4,"All play areas have seating within covered shelters to provide shade from sun, wind, and/or inclement weather. ",,ComfortWellnessCultural Appropriateness,Schematic DesignDesign Development,1,14,1 Credit: Implement 4 of 6,Fig_795.png,A covered shelter provides a place for visitors to gather together and protects people from inhospitable weather. ,Plan drawing of an enclosed playground with seating inside and outside a shelter.,Latest Version,,,,,,,,,,,,
371,797,6.14.5,H2,6,Rooms and Spaces,30,14,Play Areas,1,0,,0,5,All play areas have trash receptacles.,,Wellness,OperationsSpecifications,1,14,1 Credit: Implement 4 of 6,,,,,,,,,,,,,,,,
372,799,6.14.6,H2,6,Rooms and Spaces,30,14,Play Areas,1,0,,0,6,"All play areas have equipment for different age, development, and ability levels.",,Body FitUnderstandingSocial IntegrationPersonalization,SpecificationsOperationsDesign Development,1,14,1 Credit: Implement 4 of 6,,,,,,,,,,,,,,,,
373,574,6.15.1,H2,6,Rooms and Spaces,30,15,Pet and Service Animal Relief Areas,1,0,,0,1,All pet and service animal relief areas are enclosed.,,Wellness,Design DevelopmentSchematic Design,1,15,1 Credit: Implement 3 of 4,,,,,,,,,,,,,,,,
374,575,6.15.2,H2,6,Rooms and Spaces,30,15,Pet and Service Animal Relief Areas,1,0,,0,2,All pet and service animal relief areas have a water trough or basin with a faucet that can replenish the supply without the need to touch the trough or basin.,,Wellness,SpecificationsOperations,1,15,1 Credit: Implement 3 of 4,,,,,,,,,,,,,,,,
375,576,6.15.3,H2,6,Rooms and Spaces,30,15,Pet and Service Animal Relief Areas,1,0,,0,3,All pet and service animal relief areas have waste clean-up tools and disposal bin.,,Wellness,Operations,1,15,1 Credit: Implement 3 of 4,,,,,,,,,,,,,,,,
376,772,6.15.4,H2,6,Rooms and Spaces,30,15,Pet and Service Animal Relief Areas,1,0,,0,4,All pet and service animal relief areas are staffed.,,Wellness,Operations,1,15,1 Credit: Implement 3 of 4,,,,,,,,,,,,,,,,
377,810,6.16.1,H2,6,Rooms and Spaces,30,16,Exercise Spaces,1,0,,0,1,All exercise spaces have cardiovascular and physical strength equipment with a clear floor space on at least one side of at least one type of each equipment.,,Body FitComfortWellness,OperationsSpecificationsDesign Development,1,16,1 Credit: Implement 2 of 4,,,,,,,,,,,,,,,,
378,705,6.16.2,H2,6,Rooms and Spaces,30,16,Exercise Spaces,1,0,,0,2,"Fitness classrooms and/or group workout rooms are provided (e.g., dance, yoga, meditation, etc.).",,Wellness,Schematic Design,1,16,1 Credit: Implement 2 of 4,,,,,,,,,,,,,,,,
379,804,6.16.3,H2,6,Rooms and Spaces,30,16,Exercise Spaces,1,0,,0,3,All exercise spaces have cleaning equipment and towels within reach.,,Body FitWellness,Operations,1,16,1 Credit: Implement 2 of 4,,,,,,,,,,,,,,,,
380,700,6.16.4,H2,6,Rooms and Spaces,30,16,Exercise Spaces,1,0,,0,4,"All exercise spaces have locker rooms, shower/bathing rooms, and toilet rooms adjacent to the space. ",,ComfortWellness,Schematic DesignDesign Development,1,16,1 Credit: Implement 2 of 4,,,,,,,,,,,,,,,,
381,502,7.1.1,H2,7,Furnishings and Equipment,12,1,Seats,1,0,,0,1,Seats have a variety of feature and height options.,,Body FitComfortPersonalization,Specifications,1,1,1 Credit: Implement 3 of 9,,,,,,,,,,,,,,,,
382,496,7.1.2,H2,7,Furnishings and Equipment,12,1,Seats,1,0,,0,2,Seats are available with armrests.,,Comfort,Specifications,1,1,1 Credit: Implement 3 of 9,,,,,,,,,,,,,,,,
383,497,7.1.3,H2,7,Furnishings and Equipment,12,1,Seats,1,0,,0,3,Seats are available with open space underneath.,,Comfort,Specifications,1,1,1 Credit: Implement 3 of 9,,,,,,,,,,,,,,,,
384,498,7.1.4,H2,7,Furnishings and Equipment,12,1,Seats,1,0,,0,4,Seats are available with backrests.,,Comfort,Specifications,1,1,1 Credit: Implement 3 of 9,,,,,,,,,,,,,,,,
385,501,7.1.5,H2,7,Furnishings and Equipment,12,1,Seats,1,0,,0,5,"All seats in secure areas are moveable, and have wheels and/or are lightweight.",,PersonalizationComfort,Specifications,1,1,1 Credit: Implement 3 of 9,Fig_223B_501A.png,Study lounge chairs on wheels,Photograph of a study lounge with several brightly colored cushioned chairs arranged in a circle. The chairs have wheels and some have a built in swivel desk for note taking.,Latest Version,,,,,,,,,,,,
386,499,7.1.6,H2,7,Furnishings and Equipment,12,1,Seats,1,0,,0,6,Seats at work stations have thoracic and lumbar support features.,,ComfortWellness,Specifications,1,1,1 Credit: Implement 3 of 9,,,,,,,,,,,,,,,,
387,808,7.1.7,H2,7,Furnishings and Equipment,12,1,Seats,1,0,,0,7,Seats for outdoor use are adjacent to a circulation space.,,Comfort,Design Development,1,1,1 Credit: Implement 3 of 9,,,,,,,,,,,,,,,,
